{
  "schema_version": 1,
  "node_id": "dataset",
  "status": "stable",
  "generated": {
    "node_id": "dataset",
    "created_with": "dataset",
    "scene_path": "res://scenes/dataset.tscn",
    "scene_uid": "uid://dkx7jmpcdb0sw",
    "root_instance_path": null,
    "script_path": "res://scripts/dataset_node.gd",
    "inheritance_chain": [
      "res://scripts/dataset_node.gd",
      "res://scripts/base_graph.gd"
    ],
    "inherits_graph": true,
    "server_typename": "DatasetName",
    "layer_name": null,
    "title_candidates": {
      "en": "Dataset",
      "ru": "Датасет",
      "kz": "Датасет"
    },
    "localized_properties": {
      "ports": {},
      "settings": {},
      "controls": {
        "ColorRect/root/Label": {
          "property": "text",
          "values": {
            "en": "Dataset",
            "ru": "Датасет",
            "kz": "Датасет"
          }
        }
      },
      "title": {
        "source_path": "ColorRect/root/Label",
        "property": "text",
        "values": {
          "en": "Dataset",
          "ru": "Датасет",
          "kz": "Датасет"
        }
      }
    },
    "base_config": {
      "meta": "{}",
      "name": ""
    },
    "ports": [
      {
        "id": "output_o3_netname",
        "scene_node": "o3",
        "scene_path": ".",
        "hint": 0,
        "server_name": "netname",
        "direction": "output",
        "datatypes": [
          "dataset_type"
        ],
        "multiple": false,
        "config_conn": false,
        "keyword": null,
        "conn_count_keyword": "netname",
        "visual": {
          "color": "#c387ffff",
          "gradient_color": "#d1a3ffff",
          "dir_vector": {
            "x": 0.0,
            "y": 1.0
          },
          "side": "bottom",
          "relative_to": {
            "role": "graph_rect",
            "scene_path": "ColorRect"
          },
          "absolute_scene_rect": {
            "x": -8.0,
            "y": 9.0,
            "w": 20.0,
            "h": 21.0
          },
          "reference_rect": {
            "x": -56.0,
            "y": -24.0,
            "w": 117.0,
            "h": 46.0
          },
          "relative_rect": {
            "x": 0.41025641025641024,
            "y": 0.717391304347826,
            "w": 0.17094017094017094,
            "h": 0.45652173913043476
          },
          "relative_origin": {
            "x": 0.49572649572649574,
            "y": 1.173913043478261
          },
          "color_family": "lilac",
          "color_label": {
            "en": "Lilac",
            "ru": "Сиреневый",
            "kz": "Ашық күлгін"
          },
          "side_label": {
            "en": "at the bottom",
            "ru": "снизу",
            "kz": "төменде"
          },
          "verbal_label": {
            "en": "Lilac port at the bottom",
            "ru": "Сиреневый порт снизу",
            "kz": "Ашық күлгін порт төменде"
          },
          "text_color": "#9e3dff"
        }
      }
    ],
    "settings": [
      {
        "id": "meta",
        "source": "base_config",
        "default": "{}",
        "ui_kind": null,
        "ui_path": null,
        "options": []
      },
      {
        "id": "name",
        "source": "base_config",
        "default": "",
        "ui_kind": null,
        "ui_path": null,
        "options": []
      }
    ],
    "icon_source": "res://node_icons/IconDataset.png",
    "static_compatible_nodes": [
      {
        "from_port": "output_o3_netname",
        "to_node": "train_begin",
        "to_port": "input_o2_netname",
        "datatypes": [
          "dataset_type"
        ],
        "confidence": "static_datatype_intersection"
      }
    ]
  },
  "docs": {
    "title": {
      "en": "Dataset",
      "ru": "Набор данных",
      "kz": "Деректер жиыны"
    },
    "summary": {
      "en": "Selects a local or available dataset for a training flow.",
      "ru": "Выбирает коллекцию примеров, на которых модель будет учиться.",
      "kz": "Оқу ағыны үшін жергілікті немесе қолжетімді деректер жиынын таңдайды."
    },
    "operation": {
      "en": "Stores the selected dataset name and schema metadata, then passes that dataset reference to Training Input. The selector uses the existing local/public dataset engine.",
      "ru": "Набор данных похож на учебник с большим количеством задач и готовых правильных ответов. Один пример может содержать изображение цифры и число, которое на ней написано, или несколько измерений цветка и название его вида. Эта нода выбирает такой набор и передаёт его в начало обучения.",
      "kz": "Таңдалған деректер жиынының атауы мен схема метадеректерін сақтап, сілтемені Training Input түйініне береді. Таңдау бар жергілікті және ашық деректер қозғалтқышын қолданады."
    },
    "compact": {
      "body": {
        "en": "Selects a local or available dataset for a training flow.",
        "ru": "Выбирает примеры и правильные ответы для обучения.",
        "kz": "Оқу ағыны үшін жергілікті немесе қолжетімді деректер жиынын таңдайды."
      }
    },
    "ports": {
      "output_o3_netname": {
        "label": {
          "en": "netname",
          "ru": "Набор данных",
          "kz": "netname"
        },
        "description": {
          "en": "Sends dataset_type data to compatible downstream nodes.",
          "ru": "Сиреневый порт снизу передаёт выбранную коллекцию примеров в ноду «Начало обучения».",
          "kz": "dataset_type түріндегі деректерді үйлесімді келесі түйіндерге береді."
        }
      }
    },
    "settings": {
      "meta": {
        "label": {
          "en": "meta",
          "ru": "Устройство набора",
          "kz": "meta"
        },
        "description": {
          "en": "Stores schema metadata supplied by the selected source.",
          "ru": "Хранит сведения о том, какие части есть в каждом примере: их названия, типы и назначение.",
          "kz": "Таңдалған дереккөздің схема метадеректерін сақтайды."
        }
      },
      "name": {
        "label": {
          "en": "name",
          "ru": "Название набора",
          "kz": "name"
        },
        "description": {
          "en": "Stores the selected model, dataset, or environment identifier.",
          "ru": "Выбирает, какой готовый или загруженный набор данных использовать.",
          "kz": "Таңдалған модель, деректер жиыны немесе орта идентификаторын сақтайды."
        }
      }
    },
    "connects_to": [],
    "examples": [
      {
        "body": {
          "ru": "MNIST содержит изображения рукописных цифр. Для каждой картинки в наборе записан правильный ответ — цифра от 0 до 9.",
          "en": "MNIST contains images of handwritten digits and the correct digit for each image.",
          "kz": "MNIST қолмен жазылған цифрлардың кескіндерін және әр кескінге сәйкес дұрыс цифрды қамтиды."
        }
      }
    ]
  }
}
