{
  "schema_version": 1,
  "node_id": "dropout",
  "status": "stable",
  "generated": {
    "node_id": "dropout",
    "created_with": "dropout",
    "scene_path": "res://scenes/dropout.tscn",
    "scene_uid": "uid://6tgq6ifq5dbw",
    "root_instance_path": null,
    "script_path": "res://scripts/dropout.gd",
    "inheritance_chain": [
      "res://scripts/dropout.gd",
      "res://scripts/base_layer.gd",
      "res://scripts/io_graph.gd",
      "res://scripts/base_graph.gd"
    ],
    "inherits_graph": true,
    "server_typename": "NeuronLayer",
    "layer_name": "Dropout",
    "title_candidates": {
      "en": "Dropout",
      "ru": "Дропаут",
      "kz": "Дропаут"
    },
    "localized_properties": {
      "ports": {},
      "settings": {},
      "controls": {
        "ColorRect/root/Label": {
          "property": "text",
          "values": {
            "en": "Dropout",
            "ru": "Дропаут",
            "kz": "Дропаут"
          }
        }
      },
      "title": {
        "source_path": "ColorRect/root/Label",
        "property": "text",
        "values": {
          "en": "Dropout",
          "ru": "Дропаут",
          "kz": "Дропаут"
        }
      }
    },
    "base_config": {
      "p": 0.0
    },
    "ports": [
      {
        "id": "input_o2_layer_in",
        "scene_node": "o2",
        "scene_path": ".",
        "hint": 0,
        "server_name": "layer_in",
        "direction": "input",
        "datatypes": [
          "layer1d"
        ],
        "multiple": false,
        "config_conn": false,
        "keyword": null,
        "conn_count_keyword": null,
        "visual": {
          "color": "#7673d9ff",
          "gradient_color": "#7673d9ff",
          "dir_vector": {
            "x": -1.0,
            "y": 0.0
          },
          "side": "left",
          "relative_to": {
            "role": "graph_rect",
            "scene_path": "ColorRect"
          },
          "absolute_scene_rect": {
            "x": -54.0,
            "y": -7.0,
            "w": 16.0,
            "h": 17.0
          },
          "reference_rect": {
            "x": -47.0,
            "y": -18.0,
            "w": 136.0,
            "h": 39.0
          },
          "relative_rect": {
            "x": -0.051470588235294115,
            "y": 0.28205128205128205,
            "w": 0.11764705882352941,
            "h": 0.4358974358974359
          },
          "relative_origin": {
            "x": -0.051470588235294115,
            "y": 0.5
          },
          "color_family": "violet",
          "color_label": {
            "en": "Violet",
            "ru": "Фиолетовый",
            "kz": "Күлгін"
          },
          "side_label": {
            "en": "on the left",
            "ru": "слева",
            "kz": "сол жақта"
          },
          "verbal_label": {
            "en": "Violet port on the left",
            "ru": "Фиолетовый порт слева",
            "kz": "Күлгін порт сол жақта"
          },
          "text_color": "#6a67d6"
        }
      },
      {
        "id": "output_o_layer_out",
        "scene_node": "o",
        "scene_path": ".",
        "hint": 0,
        "server_name": "layer_out",
        "direction": "output",
        "datatypes": [
          "layer1d"
        ],
        "multiple": false,
        "config_conn": false,
        "keyword": null,
        "conn_count_keyword": null,
        "visual": {
          "color": "#7673d9ff",
          "gradient_color": "#7673d9ff",
          "dir_vector": {
            "x": 1.0,
            "y": 0.0
          },
          "side": "right",
          "relative_to": {
            "role": "graph_rect",
            "scene_path": "ColorRect"
          },
          "absolute_scene_rect": {
            "x": 81.0,
            "y": -7.0,
            "w": 16.0,
            "h": 17.0
          },
          "reference_rect": {
            "x": -47.0,
            "y": -18.0,
            "w": 136.0,
            "h": 39.0
          },
          "relative_rect": {
            "x": 0.9411764705882353,
            "y": 0.28205128205128205,
            "w": 0.11764705882352941,
            "h": 0.4358974358974359
          },
          "relative_origin": {
            "x": 1.0588235294117647,
            "y": 0.5
          },
          "color_family": "violet",
          "color_label": {
            "en": "Violet",
            "ru": "Фиолетовый",
            "kz": "Күлгін"
          },
          "side_label": {
            "en": "on the right",
            "ru": "справа",
            "kz": "оң жақта"
          },
          "verbal_label": {
            "en": "Violet port on the right",
            "ru": "Фиолетовый порт справа",
            "kz": "Күлгін порт оң жақта"
          },
          "text_color": "#6a67d6"
        }
      }
    ],
    "settings": [
      {
        "id": "p",
        "source": "base_config",
        "default": 0.0,
        "ui_kind": null,
        "ui_path": null,
        "options": []
      }
    ],
    "icon_source": "res://node_icons/IconDropout.png",
    "static_compatible_nodes": [
      {
        "from_port": "output_o_layer_out",
        "to_node": "classifier",
        "to_port": "input_ni_layer_in",
        "datatypes": [
          "layer1d"
        ],
        "confidence": "static_datatype_intersection"
      },
      {
        "from_port": "output_o_layer_out",
        "to_node": "reshape2d",
        "to_port": "input_o2_layer_in",
        "datatypes": [
          "layer1d"
        ],
        "confidence": "static_datatype_intersection"
      },
      {
        "from_port": "output_o_layer_out",
        "to_node": "softmax",
        "to_port": "input_o2_layer_in",
        "datatypes": [
          "layer1d"
        ],
        "confidence": "static_datatype_intersection"
      },
      {
        "from_port": "output_o_layer_out",
        "to_node": "layer",
        "to_port": "input_ni_layer_in",
        "datatypes": [
          "layer1d"
        ],
        "confidence": "static_datatype_intersection"
      },
      {
        "from_port": "output_o_layer_out",
        "to_node": "dropout",
        "to_port": "input_o2_layer_in",
        "datatypes": [
          "layer1d"
        ],
        "confidence": "static_datatype_intersection"
      },
      {
        "from_port": "output_o_layer_out",
        "to_node": "gru_cell",
        "to_port": "input_ni_layer_in",
        "datatypes": [
          "layer1d"
        ],
        "confidence": "static_datatype_intersection"
      },
      {
        "from_port": "output_o_layer_out",
        "to_node": "concat",
        "to_port": "input_connection_o_layer_in",
        "datatypes": [
          "layer1d"
        ],
        "confidence": "static_datatype_intersection"
      }
    ]
  },
  "docs": {
    "title": {
      "en": "Dropout",
      "ru": "Dropout",
      "kz": "Дропаут"
    },
    "summary": {
      "en": "Randomly masks part of a feature vector during training.",
      "ru": "На время обучения выключает случайные нейроны, чтобы модель не запоминала примеры наизусть.",
      "kz": "Оқу кезінде белгілер векторының бір бөлігін кездейсоқ өшіреді."
    },
    "operation": {
      "en": "Each training step sets a configured fraction of values to zero to reduce overfitting. The layer shape is preserved, and evaluation uses the complete signal.",
      "ru": "Во время каждого шага обучения Dropout временно выключает случайно выбранную часть нейронов предыдущего слоя. На следующем шаге он выбирает уже другие нейроны. Поэтому вся сеть учится решать задачу вместе и меньше зависит от нескольких любимых нейронов. Когда обучение закончено и модель просто даёт ответы, Dropout никого не выключает.",
      "kz": "Артық үйренуді азайту үшін әр оқу қадамында мәндердің берілген бөлігі нөлге айналады. Қабат пішіні сақталады."
    },
    "compact": {
      "body": {
        "en": "Randomly masks part of a feature vector during training.",
        "ru": "Тренирует сеть работать без случайной части нейронов.",
        "kz": "Оқу кезінде белгілер векторының бір бөлігін кездейсоқ өшіреді."
      }
    },
    "ports": {
      "input_o2_layer_in": {
        "label": {
          "en": "layer_in",
          "ru": "Ответы нейронов",
          "kz": "layer_in"
        },
        "description": {
          "en": "Receives layer1d data through the layer_in input.",
          "ru": "Фиолетовый порт слева принимает цепочку ответов от предыдущего слоя.",
          "kz": "layer_in кірісі арқылы layer1d түріндегі деректерді қабылдайды."
        }
      },
      "output_o_layer_out": {
        "label": {
          "en": "layer_out",
          "ru": "Ответы после Dropout",
          "kz": "layer_out"
        },
        "description": {
          "en": "Sends layer1d data to compatible downstream nodes.",
          "ru": "Фиолетовый порт справа передаёт цепочку той же длины дальше. Во время обучения часть ответов в ней временно обнуляется.",
          "kz": "layer1d түріндегі деректерді үйлесімді келесі түйіндерге береді."
        }
      }
    },
    "settings": {
      "p": {
        "label": {
          "en": "p",
          "ru": "Доля выключаемых нейронов",
          "kz": "p"
        },
        "description": {
          "en": "Sets the fraction of values masked during training.",
          "ru": "Задаёт, какую часть нейронов временно выключать на каждом шаге обучения. Например, 0,2 означает примерно 20%.",
          "kz": "Оқу кезінде өшірілетін мәндер үлесін анықтайды."
        }
      }
    },
    "connects_to": [],
    "examples": [
      {
        "body": {
          "ru": "Если предыдущий слой содержит 100 нейронов, при значении 0,2 Dropout на каждом шаге временно выключает примерно 20 случайных нейронов. На следующем шаге набор выключенных нейронов изменится.",
          "en": "A value of 0.2 means that about 20% of values are disabled during each training step.",
          "kz": "0,2 мәні әр оқыту қадамында мәндердің шамамен 20%-ы өшірілетінін білдіреді."
        }
      }
    ]
  }
}
