{
  "schema_version": 1,
  "node_id": "reshape2d",
  "status": "stable",
  "generated": {
    "node_id": "reshape2d",
    "created_with": "reshape2d",
    "scene_path": "res://scenes/reshape.tscn",
    "scene_uid": "uid://b743v0abvh8r1",
    "root_instance_path": null,
    "script_path": "res://scripts/reshape.gd",
    "inheritance_chain": [
      "res://scripts/reshape.gd",
      "res://scripts/base_graph.gd"
    ],
    "inherits_graph": true,
    "server_typename": "Reshape2D",
    "layer_name": null,
    "title_candidates": {
      "en": "Reshape2D",
      "ru": "Переформ2D",
      "kz": "ПішінӨзгерту2D"
    },
    "localized_properties": {
      "ports": {},
      "settings": {},
      "controls": {
        "ColorRect/root/Label": {
          "property": "text",
          "values": {
            "en": "Reshape2D",
            "ru": "Переформ2D",
            "kz": "ПішінӨзгерту2D"
          }
        }
      },
      "title": {
        "source_path": "ColorRect/root/Label",
        "property": "text",
        "values": {
          "en": "Reshape2D",
          "ru": "Переформ2D",
          "kz": "ПішінӨзгерту2D"
        }
      }
    },
    "base_config": {
      "columns": 0,
      "rows": 0
    },
    "ports": [
      {
        "id": "input_o2_layer_in",
        "scene_node": "o2",
        "scene_path": ".",
        "hint": 0,
        "server_name": "layer_in",
        "direction": "input",
        "datatypes": [
          "layer1d",
          "input1d"
        ],
        "multiple": false,
        "config_conn": false,
        "keyword": null,
        "conn_count_keyword": null,
        "visual": {
          "color": "#ffb8f4ff",
          "gradient_color": "#ffb8f4ff",
          "dir_vector": {
            "x": -1.0,
            "y": 0.0
          },
          "side": "left",
          "relative_to": {
            "role": "graph_rect",
            "scene_path": "ColorRect"
          },
          "absolute_scene_rect": {
            "x": -50.0,
            "y": -14.0,
            "w": 16.0,
            "h": 21.0
          },
          "reference_rect": {
            "x": -42.0,
            "y": -30.0,
            "w": 105.0,
            "h": 55.0
          },
          "relative_rect": {
            "x": -0.0761904761904762,
            "y": 0.2909090909090909,
            "w": 0.1523809523809524,
            "h": 0.38181818181818183
          },
          "relative_origin": {
            "x": -0.0761904761904762,
            "y": 0.4818181818181818
          },
          "color_family": "pink",
          "color_label": {
            "en": "Pink",
            "ru": "Розовый",
            "kz": "Қызғылт"
          },
          "side_label": {
            "en": "on the left",
            "ru": "слева",
            "kz": "сол жақта"
          },
          "verbal_label": {
            "en": "Pink port on the left",
            "ru": "Розовый порт слева",
            "kz": "Қызғылт порт сол жақта"
          },
          "text_color": "#d700b5"
        }
      },
      {
        "id": "output_o_layer_out",
        "scene_node": "o",
        "scene_path": ".",
        "hint": 0,
        "server_name": "layer_out",
        "direction": "output",
        "datatypes": [
          "layer2d"
        ],
        "multiple": true,
        "config_conn": false,
        "keyword": null,
        "conn_count_keyword": null,
        "visual": {
          "color": "#ffb8f4ff",
          "gradient_color": "#ffb8f4ff",
          "dir_vector": {
            "x": 1.0,
            "y": 0.0
          },
          "side": "right",
          "relative_to": {
            "role": "graph_rect",
            "scene_path": "ColorRect"
          },
          "absolute_scene_rect": {
            "x": 55.0,
            "y": -14.0,
            "w": 16.0,
            "h": 21.0
          },
          "reference_rect": {
            "x": -42.0,
            "y": -30.0,
            "w": 105.0,
            "h": 55.0
          },
          "relative_rect": {
            "x": 0.9238095238095239,
            "y": 0.2909090909090909,
            "w": 0.1523809523809524,
            "h": 0.38181818181818183
          },
          "relative_origin": {
            "x": 1.0761904761904761,
            "y": 0.4818181818181818
          },
          "color_family": "pink",
          "color_label": {
            "en": "Pink",
            "ru": "Розовый",
            "kz": "Қызғылт"
          },
          "side_label": {
            "en": "on the right",
            "ru": "справа",
            "kz": "оң жақта"
          },
          "verbal_label": {
            "en": "Pink port on the right",
            "ru": "Розовый порт справа",
            "kz": "Қызғылт порт оң жақта"
          },
          "text_color": "#d700b5"
        }
      }
    ],
    "settings": [
      {
        "id": "columns",
        "source": "base_config",
        "default": 0,
        "ui_kind": null,
        "ui_path": null,
        "options": []
      },
      {
        "id": "rows",
        "source": "base_config",
        "default": 0,
        "ui_kind": null,
        "ui_path": null,
        "options": []
      }
    ],
    "icon_source": "res://node_icons/IconReshape2d.png",
    "static_compatible_nodes": [
      {
        "from_port": "output_o_layer_out",
        "to_node": "flatten",
        "to_port": "input_o2_layer_in",
        "datatypes": [
          "layer2d"
        ],
        "confidence": "static_datatype_intersection"
      },
      {
        "from_port": "output_o_layer_out",
        "to_node": "conv2d",
        "to_port": "input_ni_layer_in",
        "datatypes": [
          "layer2d"
        ],
        "confidence": "static_datatype_intersection"
      },
      {
        "from_port": "output_o_layer_out",
        "to_node": "maxpool",
        "to_port": "input_ni_layer_in",
        "datatypes": [
          "layer2d"
        ],
        "confidence": "static_datatype_intersection"
      }
    ]
  },
  "docs": {
    "title": {
      "en": "Reshape2D",
      "ru": "Из списка в сетку",
      "kz": "2D пішінге өзгерту"
    },
    "summary": {
      "en": "Rearranges one-dimensional features into a two-dimensional tensor.",
      "ru": "Перекладывает цепочку чисел в прямоугольную сетку.",
      "kz": "Бір өлшемді белгілерді екі өлшемді тензорға қайта орналастырады."
    },
    "operation": {
      "en": "Changes only the tensor shape to the configured row and column count. The total number of elements must remain compatible with the input.",
      "ru": "Нода берёт числа из одной длинной цепочки и раскладывает их по строкам и столбцам. Сами числа и их порядок не меняются — меняется только форма. Чтобы все числа поместились, количество строк нужно умножить на количество столбцов: результат должен равняться длине цепочки.",
      "kz": "Тек тензор пішінін берілген жолдар мен бағандар санына өзгертеді. Элементтердің жалпы саны кіріспен сәйкес болуы керек."
    },
    "compact": {
      "body": {
        "en": "Rearranges one-dimensional features into a two-dimensional tensor.",
        "ru": "Перекладывает цепочку чисел в сетку.",
        "kz": "Бір өлшемді белгілерді екі өлшемді тензорға қайта орналастырады."
      }
    },
    "ports": {
      "input_o2_layer_in": {
        "label": {
          "en": "layer_in",
          "ru": "Цепочка чисел",
          "kz": "layer_in"
        },
        "description": {
          "en": "Receives layer1d, input1d data through the layer_in input.",
          "ru": "Розовый порт слева принимает одну длинную цепочку чисел.",
          "kz": "layer_in кірісі арқылы layer1d, input1d түріндегі деректерді қабылдайды."
        }
      },
      "output_o_layer_out": {
        "label": {
          "en": "layer_out",
          "ru": "Сетка чисел",
          "kz": "layer_out"
        },
        "description": {
          "en": "Sends layer2d data to compatible downstream nodes.",
          "ru": "Розовый порт справа передаёт те же числа, разложенные по строкам и столбцам.",
          "kz": "layer2d түріндегі деректерді үйлесімді келесі түйіндерге береді."
        }
      }
    },
    "settings": {
      "columns": {
        "label": {
          "en": "columns",
          "ru": "Столбцы",
          "kz": "columns"
        },
        "description": {
          "en": "Sets the number of columns in the 2D output.",
          "ru": "Задаёт ширину новой сетки — сколько чисел будет в каждой строке.",
          "kz": "2D шығысындағы бағандар санын анықтайды."
        }
      },
      "rows": {
        "label": {
          "en": "rows",
          "ru": "Строки",
          "kz": "rows"
        },
        "description": {
          "en": "Sets the number of rows in the 2D output.",
          "ru": "Задаёт высоту новой сетки — сколько в ней будет строк.",
          "kz": "2D шығысындағы жолдар санын анықтайды."
        }
      }
    },
    "connects_to": [],
    "examples": [
      {
        "body": {
          "ru": "Цепочку из 784 чисел можно переложить в сетку 28 × 28, потому что 28 × 28 = 784.",
          "en": "A list of 784 numbers can be reshaped into a 28 × 28 grid.",
          "kz": "784 саннан тұратын тізімді 28 × 28 кестесіне айналдыруға болады."
        }
      }
    ]
  }
}
